{"authorizations":{"calibration_development_run_authorized":false,"dvc_commands_authorized":false,"dvc_push_authorized":false,"e0_m_authorized":false,"e0_u_authorized":false,"e7_learning_curve_run_authorized":false,"effective_in_payload":false,"git_commit_authorized":false,"git_push_authorized":false,"holdout_access_authorized":false,"locked_evaluation_authorized":false,"outcome_access_authorized":false,"post_2021_access_authorized":false,"scientific_network_authorized":false},"calibration_group_matrix":{"bloom_group_count":66,"bloom_group_key":["model_id","model_seed","horizon_months"],"bloom_group_target_universe_policy":"exact_identity_set_equality_no_partial_groups","bloom_groups_with_exact_complete_target_universe":66,"complete_target_count":2646,"complete_target_counts_by_target_year_horizon":{"2019":{"1":397,"2":371,"3":344},"2020":{"1":261,"2":287,"3":314},"2021":{"1":224,"2":224,"3":224}},"complete_target_identity_key":["source_id","site_id","origin_year_month","target_year_month","horizon_months"],"cross_group_pooling":"no_pooling","horizons_months":[1,2,3],"ordinal_completed_group_count":30,"ordinal_group_count":33,"ordinal_group_key":["model_id","model_seed","horizon_months"],"ordinal_unavailable_cutpoints":null,"ordinal_unavailable_group_count":3,"ordinal_unavailable_model_ids":["B0"],"ordinal_unavailable_status":"not_available_degenerate_constant_score","q_c_levels":[0.8,0.9,0.95],"q_c_record_count":90,"uncertainty_group_count":30,"uncertainty_group_key":["model_id","model_seed","horizon_months"],"uncertainty_model_ids":["A0","A1"]},"e7_terminal_record":{"base_seeds":[1729,20260612,20260613,20260614,314159],"checkpoint_or_model_write_count":0,"completed_metric_ids":["expert_anchor_fidelity","membership_stability","deterministic_computational_cost_proxy"],"completed_semantics":"anfis_module_fit_only_not_downstream_ablation","completed_training_rows_per_module":[4096],"computational_cost_proxy":"deterministic_update_count_and_sample_count_no_wall_clock","downstream_blockers":["P0_model_unavailable","P1_model_unavailable"],"downstream_metrics_status":"not_estimable_without_separate_temporal_consumers","e7_fit_identity_key":["experiment_id","training_rows_per_module","base_seed","module_id"],"eligible_rows_by_module":{"ANFIS-F":35273,"ANFIS-N":4757,"ANFIS-T-no-current":35419},"exact_record_per_required_size":true,"expected_completed_module_fit_count":15,"expected_completed_slot_count":5,"expected_preflight_record_count":45,"expected_resource_failure_record_count":10,"expected_slot_count":15,"experiment_id":"E7","expert_anchor_band_boundaries":[0.0,0.3333333333333333,0.6666666666666666,1.0],"expert_anchor_band_labels":["low","middle","high"],"expert_anchor_band_target_scope":"per_target_module","family80_no_touch":true,"historical_blockers_adopted":[{"bytes":46105,"e7_learning_curve_sizes_authorized":"not_declared","e7_learning_curve_status":"blocked_pending_sampling_strata_contract","git_mode":"100644","git_oid":"5970ab73eedb20f464f804a185a3057daba93ab3","path":"configs/closure_v1/development_runtime.yaml","sha256":"0b2588248ee006f7d8e8843291b6a5847201a36fed35422473c9c0aa9492b10d"},{"bytes":22694,"e7_learning_curve_sizes_authorized":"not_declared","e7_learning_curve_status":"blocked_for_separate_gate","git_mode":"100644","git_oid":"94f84be4346fd4e01fd52d207b932e21022fc436","path":"configs/closure_v1/anfis_ablation_training_development_runtime.yaml","sha256":"cf2cec52d9027db895e8859c7ffb321c831b66510132e137759e567b363f6a50"},{"bytes":21827,"e7_learning_curve_sizes_authorized":false,"e7_learning_curve_status":"blocked_for_separate_gate","git_mode":"100644","git_oid":"f9956fb51a8b0a742831c3400cc9624f4369fe90","path":"configs/closure_v1/anfis_ablation_sequence_development_runtime.yaml","sha256":"49d1a3f562f2cd68ff65f29c92ac4e028b3ad407f30a9960ea0d29260df7d56b"}],"historical_e7_blocker_adopted":true,"holdout_group_id_derivation":"source_id_double_colon_site_id_verified_against_assignment","new_e7_fit_count":15,"preflight_module_count_per_slot":3,"prelock_status":"pending_authorized_terminalization","primary_4096_hash_rank_reuse_forbidden":true,"primary_fit_reuse_count":0,"primary_fit_scope":"hash_rank_not_reused","required_training_rows_per_module":[4096,16384,65536],"resource_failure_timing":"pre_fit_exact_eligibility_check","resource_failure_training_rows_per_module":[16384,65536],"retain_completed_sizes_without_post_hoc_substitution":true,"sampling_strata":["holdout_group_id","temporal_period","expert_anchor_band"],"saturation_claim_authorized_if_incomplete":false,"silent_omission_allowed":false,"stratum_derivation_evidence":"boundaries_maps_and_sha256_digests_required","supersession_scope":"e7_only_additive_authority","temporal_period_derivation":"ordered_unique_eligible_month_index_floor_3i_over_n","temporal_period_labels":["early","middle","late"],"temporal_period_target_scope":"per_target_module_after_eligibility_filter","terminal_statuses":["completed","resource_failure_recorded"],"wall_clock_metric_authoritative":false},"experiment_id":"closure_v1","failed_attempt":{"active_guard_count":0,"anfis_inference_slot_count":10,"attempted_gate":"E0-MCALH","authorization_consumed":true,"bundle_payload_built":true,"calibration_fit_performed":true,"dvc_commands_run":false,"failure_code":"owned_calibration_guard_rejected_by_effective_namespace_revalidation","filesystem_side_effect_count":0,"final_output_count":0,"holdout_rows_opened":false,"model_inference_performed":true,"outcome_paths_opened":false,"owned_guard_acquired":true,"phase":"calibration_bundle_publication_authority_revalidation","post_2021_rows_opened":false,"provisional_output_count":6,"retry_authorized":false,"rollback_complete":true,"rollback_performed":true,"scientific_input_reads_performed":true,"status":"failed_closed_rolled_back_no_outputs","temporary_output_count":0},"gate":"E0-MCALI","generated_at_utc":"2026-08-12T12:11:05.928312+00:00","h_patch":{"added_count":5,"component_count":9,"components":[{"bytes":14090,"git_mode":"100644","git_oid":"30bbf2448fc76216f05ad1c3e2a22afa0bf3aae9","path":"configs/closure_v1/final_calibration_owned_run_guard_revalidation_patch_lock.schema.json","role":"final_calibration_owned_run_guard_revalidation_patch_component","sha256":"28f79f9ff36018c640b3078c3b17b5ab6a5be01f1c73df41cdf38aca59c7fb40"},{"bytes":10193,"git_mode":"100644","git_oid":"8de275477bd8b9c9b714c73bb08e06a2d6b33bb7","path":"docs/closure_v1/E0_M_FINAL_CALIBRATION_OWNED_RUN_GUARD_REVALIDATION_PATCH_1.md","role":"final_calibration_owned_run_guard_revalidation_patch_component","sha256":"5cd59d1b7ffe2eff4fc927601bda8f8d2a849b9fab28800c148cd4a019314903"},{"bytes":165724,"git_mode":"100644","git_oid":"d638d2910877270d3fe9526befe05298640c79f1","path":"src/experiments/calibrate_closure_final_models.py","role":"final_calibration_owned_run_guard_revalidation_patch_component","sha256":"1feed81ec89cad6519ef20d1306c6563be8fba7baa888e17a22b5dc6258f5d05"},{"bytes":103338,"git_mode":"100644","git_oid":"a4cfbdf1b79033ef52cc55f7376229671a55d0f2","path":"src/experiments/closure_final_calibration_owned_run_guard_revalidation_patch.py","role":"final_calibration_owned_run_guard_revalidation_patch_component","sha256":"b8371339a7fb482ad8feb49e95f6f93fed955eff10092083ae2a60ce129e3cc2"},{"bytes":9171,"git_mode":"100644","git_oid":"a28d038921f2a4ed2c3ae34644db47a7ca0e23b7","path":"src/experiments/lock_closure_final_calibration_owned_run_guard_revalidation_patch.py","role":"final_calibration_owned_run_guard_revalidation_patch_component","sha256":"913630e8a28a52ff4b9919a0ee3639708daa075b20e3497ff221f87beedc240f"},{"bytes":78646,"git_mode":"100644","git_oid":"da51c78e64bfc0edd8747cf588645083dfc5f3af","path":"src/experiments/run_closure_anfis_learning_curve.py","role":"final_calibration_owned_run_guard_revalidation_patch_component","sha256":"4cd46948336aebfe60dc3c048beb52338750fe530d0ed47f21edb0234a51361f"},{"bytes":114790,"git_mode":"100644","git_oid":"41c05e2616903570579f154c7e68fdd5c31bd9a7","path":"tests/test_calibrate_closure_final_models.py","role":"final_calibration_owned_run_guard_revalidation_patch_component","sha256":"a97517606faac764c284d517aa8e33ff6968cabde1fb00bd10a652b83f421a74"},{"bytes":65361,"git_mode":"100644","git_oid":"46e669f2a8c9ba36e18774a7d105265171614567","path":"tests/test_closure_anfis_learning_curve.py","role":"final_calibration_owned_run_guard_revalidation_patch_component","sha256":"813c75fae3b93723f55e55bf4561891c4f2e06225b99b7014d89c9d65cb4faa2"},{"bytes":59150,"git_mode":"100644","git_oid":"1e713ae52d4e9d4f3c8edc9f41bdb91cb0e95b6c","path":"tests/test_closure_final_calibration_owned_run_guard_revalidation_patch.py","role":"final_calibration_owned_run_guard_revalidation_patch_component","sha256":"ba2d92a1d79c11ef9de0cdd19dec2cd717d4b9eb21324c72adc56d42629cbf13"}],"components_sha256":"dffb449718c26da00cd255b5667d7e39f6eaf1fbe5d3d75a1dc081aaebde87dd","gate":"H-E0-MCALI","modified_count":4},"model_matrix":{"available_calibrable_count":6,"available_not_applicable_count":2,"model_count":11,"ordered_model_ids":["B0","B1","B2","F0","F1","P0","P1","M0","A0","A1","A2"],"records":[{"availability":"available","availability_reason":"published_deterministic_baseline","bloom_calibration":"fixed_identity_no_refit","bloom_score_source":"predicted_bloom_probability","calibration_seed_source":"technical_seed","horizons_months":[1,2,3],"model_id":"B0","ordinal_calibration":"record_not_available_degenerate_constant_score","seed_policy":"deterministic_technical_seed","seeds":[1729],"selected_family":false,"uncertainty_calibration":"not_applicable"},{"availability":"available","availability_reason":"published_seeded_baseline_family","bloom_calibration":"select_then_refit","bloom_score_source":"predicted_bloom_probability","calibration_seed_source":"upstream_state_seed","horizons_months":[1,2,3],"model_id":"B1","ordinal_calibration":"select_cutpoints","seed_policy":"exact_five_prespecified_seeds","seeds":[1729,20260612,20260613,20260614,314159],"selected_family":fal